{
  "observation_contract_version": "RAW-OBS-V0",
  "observations_digest": "sha256:8be202ed47fbf0fc95288df179037b061e02192f6a48f6507b6cab5eaad0ce98",
  "observed_at": "2026-09-05T12:00:00Z",
  "policy_version": "devostasis.policy.v1",
  "schema": "devostasis.snapshot.v1",
  "subject": {
    "default_branch": "master",
    "display_locator": "acme/widget",
    "forge_instance": "github.com",
    "immutable_project_id": "123456",
    "owner": "acme",
    "provider": "github",
    "repo": "widget",
    "visibility": "public"
  },
  "vitals": [
    {
      "band": "EXTENDED",
      "band_semantics": "EXACT",
      "dependency_group_ids": [
        "HORIZON_DIRECTION_PLANNING"
      ],
      "derived": {
        "capability": "SUPPORTED",
        "nearest_future_boundary_days": 55,
        "open_beyond_28d_count": 1,
        "open_count": 1,
        "open_with_future_boundary_count": 1
      },
      "diagnostics": [],
      "evaluation_status": "AVAILABLE",
      "explanation": "1 open planning targets, 1 with a future boundary, 1 reaching beyond 28 days.",
      "inputs": [
        {
          "freshness": "FRESH",
          "observation_id": "planning.explicit_targets.capability",
          "status": "AVAILABLE"
        },
        {
          "freshness": "FRESH",
          "observation_id": "planning.explicit_targets.open_count",
          "status": "AVAILABLE"
        },
        {
          "freshness": "FRESH",
          "observation_id": "planning.explicit_targets.open_with_future_boundary_count",
          "status": "AVAILABLE"
        },
        {
          "freshness": "FRESH",
          "observation_id": "planning.explicit_targets.open_beyond_28d_count",
          "status": "AVAILABLE"
        },
        {
          "freshness": "FRESH",
          "observation_id": "planning.explicit_targets.nearest_future_boundary_days",
          "status": "AVAILABLE"
        }
      ],
      "policy_version": "devostasis.policy.v1",
      "possible_bands": null,
      "rule_id": "horizon.bands.v1",
      "shared_signal_groups": [
        "PLANNING_TARGETS"
      ],
      "vital_id": "horizon",
      "vital_version": "PV-VITALS-V1-002/horizon",
      "vitals_contract_version": "PV-VITALS-V1-002"
    },
    {
      "band": "LIGHT",
      "band_semantics": "EXACT",
      "dependency_group_ids": [
        "CLUTTER_FLOW_FORGE"
      ],
      "derived": {
        "components": {
          "branches": {
            "stale_30d": 1
          },
          "change_requests": {
            "open": 2,
            "stale_14d": 0
          },
          "issues": {
            "open": 3,
            "stale_30d": 1
          }
        },
        "stale_branch_count": 1,
        "stale_work_count": 1,
        "stale_work_ratio": {
          "den": 5,
          "num": 1
        },
        "tracked_open_count": 5
      },
      "diagnostics": [],
      "evaluation_status": "AVAILABLE",
      "explanation": "1 stale work items out of 5 tracked open items; 1 stale non-default branches.",
      "inputs": [
        {
          "freshness": "FRESH",
          "observation_id": "forge.issues.open_count",
          "status": "AVAILABLE"
        },
        {
          "freshness": "FRESH",
          "observation_id": "forge.issues.stale_open_count_30d",
          "status": "AVAILABLE"
        },
        {
          "freshness": "FRESH",
          "observation_id": "forge.change_requests.open_count",
          "status": "AVAILABLE"
        },
        {
          "freshness": "FRESH",
          "observation_id": "forge.change_requests.stale_open_count_14d",
          "status": "AVAILABLE"
        },
        {
          "freshness": "FRESH",
          "observation_id": "git.nondefault_branches.stale_count_30d",
          "status": "AVAILABLE"
        }
      ],
      "policy_version": "devostasis.policy.v1",
      "possible_bands": null,
      "rule_id": "clutter.bands.v0",
      "shared_signal_groups": [
        "FORGE_INVENTORY",
        "BRANCH_RESIDUE"
      ],
      "vital_id": "clutter",
      "vital_version": "PV-VITALS-V1-002/clutter",
      "vitals_contract_version": "PV-VITALS-V1-002"
    },
    {
      "band": "MIXED",
      "band_semantics": "EXACT",
      "dependency_group_ids": [
        "HORIZON_DIRECTION_PLANNING",
        "DIRECTION_PULSE_ACTIVITY"
      ],
      "derived": {
        "active_change_count_28d": 10,
        "capability": "SUPPORTED",
        "linked_active_change_count_28d": 5,
        "links_per_target": {
          "3": 5
        },
        "unlinked_active_change_count_28d": 5
      },
      "diagnostics": [
        "ALL_LINKS_TO_SINGLE_TARGET"
      ],
      "evaluation_status": "AVAILABLE",
      "explanation": "5 of 10 active change requests are explicitly linked to an open planning target.",
      "inputs": [
        {
          "freshness": "FRESH",
          "observation_id": "planning.linkage.active_change_requests_count_28d",
          "status": "AVAILABLE"
        },
        {
          "freshness": "FRESH",
          "observation_id": "planning.linkage.active_change_requests_linked_to_open_target_count_28d",
          "status": "AVAILABLE"
        },
        {
          "freshness": "FRESH",
          "observation_id": "planning.explicit_targets.capability",
          "status": "AVAILABLE"
        },
        {
          "freshness": "FRESH",
          "observation_id": "planning.linkage.links_per_target_28d",
          "status": "AVAILABLE"
        }
      ],
      "policy_version": "devostasis.policy.v1",
      "possible_bands": null,
      "rule_id": "direction.bands.v1.1",
      "shared_signal_groups": [
        "PLANNING_TARGETS",
        "CHANGE_REQUEST_ACTIVITY"
      ],
      "vital_id": "direction",
      "vital_version": "PV-VITALS-V1-002/direction",
      "vitals_contract_version": "PV-VITALS-V1-002"
    },
    {
      "band": "MOVING",
      "band_semantics": "EXACT",
      "dependency_group_ids": [
        "CLUTTER_FLOW_FORGE",
        "FLOW_PULSE_ACTIVITY"
      ],
      "derived": {
        "median_time_to_merge_hours_28d": 20,
        "median_time_to_merge_seconds_28d": {
          "denominator": 1,
          "numerator": 72000
        },
        "merged_count_28d": 8,
        "oldest_open_age_days": 3,
        "open_count": 2
      },
      "diagnostics": [],
      "evaluation_status": "AVAILABLE",
      "explanation": "2 open change requests; 8 merged in 28 days; oldest open for 3 days; median time to merge 20h 0m.",
      "inputs": [
        {
          "freshness": "FRESH",
          "observation_id": "forge.change_requests.open_count",
          "status": "AVAILABLE"
        },
        {
          "freshness": "FRESH",
          "observation_id": "forge.change_requests.merged_count_28d",
          "status": "AVAILABLE"
        },
        {
          "freshness": "FRESH",
          "observation_id": "forge.change_requests.oldest_open_age_days",
          "status": "AVAILABLE"
        },
        {
          "freshness": "FRESH",
          "observation_id": "forge.change_requests.median_time_to_merge_seconds_28d",
          "status": "AVAILABLE"
        }
      ],
      "policy_version": "devostasis.policy.v1",
      "possible_bands": null,
      "rule_id": "flow.bands.v1",
      "shared_signal_groups": [
        "CHANGE_REQUEST_INVENTORY",
        "CHANGE_REQUEST_ACTIVITY"
      ],
      "vital_id": "flow",
      "vital_version": "PV-VITALS-V1-002/flow",
      "vitals_contract_version": "PV-VITALS-V1-002"
    },
    {
      "band": "FLAKY",
      "band_semantics": "EXACT",
      "dependency_group_ids": [
        "INTEGRITY_ONLY"
      ],
      "derived": {
        "current_revision": {
          "committed_at": "2026-08-29T09:00:00Z",
          "current_verdict": "VERIFY_PASS",
          "history_state": "PASS_ONLY_OBSERVED",
          "revision": "0000000000000000000000000000000000000013"
        },
        "decisive_count_14d": 8,
        "failed_count_14d": 1,
        "failure_ratio_14d": {
          "den": 8,
          "num": 1
        },
        "history_provenance": {
          "ATTEMPT_LEVEL": 8
        },
        "revisions_in_window": 8,
        "revisions_with_verification": 8,
        "sample_strength": "ESTABLISHED"
      },
      "diagnostics": [],
      "evaluation_status": "AVAILABLE",
      "explanation": "1 of 8 decisive revisions failed verification in 14 days; latest decisive verdict is VERIFY_PASS.",
      "inputs": [
        {
          "freshness": "FRESH",
          "observation_id": "ci.configured",
          "status": "AVAILABLE"
        },
        {
          "freshness": "FRESH",
          "observation_id": "ci.revision_verdicts_14d",
          "status": "AVAILABLE"
        }
      ],
      "policy_version": "devostasis.policy.v1",
      "possible_bands": null,
      "rule_id": "integrity.bands.v1+ci-unit-004",
      "shared_signal_groups": [
        "CI_VERIFICATION"
      ],
      "vital_id": "integrity",
      "vital_version": "PV-VITALS-V1-002/integrity",
      "vitals_contract_version": "PV-VITALS-V1-002"
    },
    {
      "band": "PRESENT",
      "band_semantics": "EXACT",
      "dependency_group_ids": [
        "DEBT_CLUTTER_MAINTENANCE"
      ],
      "derived": {
        "capability": "CONFIGURED",
        "closed_count_28d": 1,
        "mapping": {
          "labels": [
            "type:refactor"
          ],
          "mapping_version": "example-1",
          "source": "labels"
        },
        "open_count": 1,
        "open_stale_count_30d": 0
      },
      "diagnostics": [],
      "evaluation_status": "AVAILABLE",
      "explanation": "1 open registered debt items under mapping version example-1.",
      "inputs": [
        {
          "freshness": "FRESH",
          "observation_id": "debt.registry.capability",
          "status": "AVAILABLE"
        },
        {
          "freshness": "FRESH",
          "observation_id": "debt.items.open_count",
          "status": "AVAILABLE"
        },
        {
          "freshness": "FRESH",